{
  "league": "1356407594683482112",
  "week": 3,
  "updated": "Today 14:20",
  "suggestions": [
    {
      "partner": "Gibbs Me Liberty",
      "partner_id": "860317606291283968",
      "partner_owner": "Shore69",
      "record": "5th",
      "partner_need": "needs RB",
      "give": {
        "id": "7021",
        "name": "Rico Dowdle",
        "pos": "RB",
        "team": "PIT",
        "inj": null,
        "prac": null,
        "proj": 11.1
      },
      "give_proj": 11.1,
      "get": {
        "id": "9481",
        "name": "Dalton Kincaid",
        "pos": "TE",
        "team": "BUF",
        "inj": null,
        "prac": null,
        "proj": 12.8
      },
      "get_proj": 12.8,
      "note": "Kincaid sits behind LaPorta on their roster; their flex is [Dobbins at 6.1 projected](https://sleeper.com/)."
    },
    {
      "partner": "Pitts and Giggles",
      "partner_id": "860265672989609984",
      "partner_owner": "nlanner",
      "record": "1st",
      "partner_need": "6 WRs",
      "give": {
        "id": "11586",
        "name": "Blake Corum",
        "pos": "RB",
        "team": "LAR",
        "inj": null,
        "prac": null,
        "proj": 7.8
      },
      "give_proj": 7.8,
      "get": {
        "id": "7569",
        "name": "Nico Collins",
        "pos": "WR",
        "team": "HOU",
        "inj": "Out",
        "prac": null,
        "proj": 14.7
      },
      "get_proj": 14.7,
      "note": "Their sixth WR, in reserve. Ask only if [he's cleared by Friday](https://www.nfl.com/injuries/)."
    },
    {
      "partner": "Achane Magic",
      "partner_id": "860209887672635392",
      "partner_owner": "cdelphin",
      "record": "4th",
      "give": {
        "id": "11586",
        "name": "Blake Corum",
        "pos": "RB",
        "team": "LAR",
        "inj": null,
        "prac": null,
        "proj": 7.8
      },
      "give_proj": 7.8,
      "get": {
        "id": "10222",
        "name": "Jayden Reed",
        "pos": "WR",
        "team": "GB",
        "inj": null,
        "prac": null,
        "proj": 11.6
      },
      "get_proj": 11.6,
      "note": "They start D'Andre Swift at RB2 at 11.6 projected; Jayden Reed sits behind three starting receivers."
    }
  ]
}
